<?xml version="1.0" encoding="UTF-8"?>

<!--
  Part of the MUST Project, under BSD-3-Clause License
 See https://hpc.rwth-aachen.de/must/LICENSE for license information.
  SPDX-License-Identifier: BSD-3-Clause
-->

<!DOCTYPE analysis-specification SYSTEM "@MUST_SPECIFICATION_DTD_PATH@/analysis-specification.dtd">
<analysis-specification path-to-libs="@CMAKE_INSTALL_PREFIX@/modules" include-path="@CMAKE_CURRENT_SOURCE_DIR@/modules" group-name="TestCommGroupTrack">
	<analyses>
		<analysis name="PrintCommGroup">
			<registered-name>PrintCommGroup</registered-name>
			<module-name>libprintCommGroup</module-name>
			<header-name>I_PrintCommGroup.h</header-name>
			<interface-type>I_PrintCommGroup</interface-type>
			<is-global>0</is-global>
			<is-process-global>0</is-process-global>
			<dependencies>
				<analysis-depend group="MUST_Base">LocationAnalysis</analysis-depend>
				<analysis-depend group="MUST_Base">CreateMessage</analysis-depend>
				<analysis-depend group="MUST_Resource">CommTrack</analysis-depend>
				<analysis-depend group="MUST_Resource">GroupTrack</analysis-depend>
                <analysis-depend group="MUST_Base">ParallelIdAnalysis</analysis-depend>
            </dependencies>
			<analysis-function name="printComm">
				<analysis-argument order="0" type="uint64_t" name="pId" /><analysis-argument
					order="1" type="uint64_t" name="lId" /><analysis-argument
					order="2" type="@COMM_F_TYPE@" name="comm" /></analysis-function>
		<analysis-function name="printGroup">
				<analysis-argument order="0" type="uint64_t" name="pId" /><analysis-argument order="1" type="uint64_t" name="lId" /><analysis-argument order="2" type="@GROUP_F_TYPE@" name="group" /></analysis-function></analysis></analyses>
	<operations></operations></analysis-specification>
