<?xml version="1.0" encoding="UTF-8"?>

<!--
  Part of the MUST Project, under BSD-3-Clause License
 See https://hpc.rwth-aachen.de/must/LICENSE for license information.
  SPDX-License-Identifier: BSD-3-Clause
-->

<!DOCTYPE analysis-specification PUBLIC "must_base" "@MUST_SPECIFICATION_DTD_PATH@/analysis-specification.dtd">
<analysis-specification
    group-name="OpenMPlocks"
    include-path=""
    path-to-libs="@CMAKE_INSTALL_PREFIX@/modules"
    enabled="@SPEC_OMPT_FOUND@">
    <analyses>
        <analysis name="OpenMPlocks">
            <registered-name>OpenMPlocks</registered-name>
            <module-name>libOpenMPlocks</module-name>
            <header-name>I_OpenMPlocks.h</header-name>
            <interface-type>must::I_OpenMPlocks</interface-type>
            <is-global>0</is-global>
            <is-process-global>0</is-process-global>
            <dependencies>
                <analysis-depend group="MUST_Base">CreateMessage</analysis-depend>
            </dependencies>

            <analysis-function name="notifyInit">
                <analysis-argument order="0" name="pId"     type="MustParallelId"/>
                <analysis-argument order="1" name="lId"     type="MustLocationId"/>
                <analysis-argument order="2" name="wait_id" type="uint64_t"/>
            </analysis-function>

            <analysis-function name="notifyDestroy">
                <analysis-argument order="0" name="wait_id" type="uint64_t"/>
            </analysis-function>

            <analysis-function name="notifyAcquired">
                <analysis-argument order="0" name="pId"     type="MustParallelId"/>
                <analysis-argument order="1" name="lId"     type="MustLocationId"/>
                <analysis-argument order="2" name="wait_id" type="uint64_t"/>
            </analysis-function>

            <analysis-function name="notifyRelease">
                <analysis-argument order="0" name="pId"     type="MustParallelId"/>
                <analysis-argument order="1" name="lId"     type="MustLocationId"/>
                <analysis-argument order="2" name="wait_id" type="uint64_t"/>
            </analysis-function>

            <analysis-function name="checkInitialized">
                <analysis-argument order="0" name="pId"     type="MustParallelId"/>
                <analysis-argument order="1" name="lId"     type="MustLocationId"/>
                <analysis-argument order="2" name="wait_id" type="uint64_t"/>
            </analysis-function>
        </analysis>

        <analysis name="OpenMPnestlocks">
            <registered-name>OpenMPlocks</registered-name>
            <module-name>libOpenMPlocks</module-name>
            <header-name>I_OpenMPlocks.h</header-name>
            <interface-type>must::I_OpenMPlocks</interface-type>
            <is-global>0</is-global>
            <is-process-global>0</is-process-global>
            <dependencies>
                <analysis-depend group="MUST_Base">CreateMessage</analysis-depend>
            </dependencies>

            <analysis-function name="notifyInit">
                <analysis-argument order="0" name="pId"     type="MustParallelId"/>
                <analysis-argument order="1" name="lId"     type="MustLocationId"/>
                <analysis-argument order="2" name="wait_id" type="uint64_t"/>
            </analysis-function>

            <analysis-function name="notifyDestroy">
                <analysis-argument order="0" name="wait_id" type="uint64_t"/>
            </analysis-function>

            <analysis-function name="notifyAcquired">
                <analysis-argument order="0" name="pId"     type="MustParallelId"/>
                <analysis-argument order="1" name="lId"     type="MustLocationId"/>
                <analysis-argument order="2" name="wait_id" type="uint64_t"/>
            </analysis-function>

            <analysis-function name="notifyRelease">
                <analysis-argument order="0" name="pId"     type="MustParallelId"/>
                <analysis-argument order="1" name="lId"     type="MustLocationId"/>
                <analysis-argument order="2" name="wait_id" type="uint64_t"/>
            </analysis-function>

            <analysis-function name="checkInitialized">
                <analysis-argument order="0" name="pId"     type="MustParallelId"/>
                <analysis-argument order="1" name="lId"     type="MustLocationId"/>
                <analysis-argument order="2" name="wait_id" type="uint64_t"/>
            </analysis-function>
        </analysis>
    </analyses>
    <operations/>
</analysis-specification>
