<?xml version="1.0" encoding="UTF-8"?>

<!--
  Part of the MUST Project, under BSD-3-Clause License
 See https://hpc.rwth-aachen.de/must/LICENSE for license information.
  SPDX-License-Identifier: BSD-3-Clause
-->

<!DOCTYPE analysis-specification SYSTEM "@MUST_SPECIFICATION_DTD_PATH@/analysis-specification.dtd">
<analysis-specification path-to-libs="@CMAKE_INSTALL_PREFIX@/modules" include-path="@CMAKE_CURRENT_SOURCE_DIR@/modules" group-name="TestOpTrack">
	<analyses>
		<analysis name="PrintOp">
			<registered-name>PrintOp</registered-name>
			<module-name>libprintOp</module-name>
			<header-name>I_PrintOp.h</header-name>
			<interface-type>I_PrintOp</interface-type>
			<is-global>0</is-global>
			<is-process-global>0</is-process-global>
			<dependencies>
				<analysis-depend group="MUST_Base">LocationAnalysis</analysis-depend>
				<analysis-depend group="MUST_Base">CreateMessage</analysis-depend>
				<analysis-depend group="MUST_Resource">OpTrack</analysis-depend></dependencies>
			<analysis-function name="print">
				<analysis-argument order="0" type="uint64_t" name="pId" /><analysis-argument
					order="1" type="uint64_t" name="lId" /><analysis-argument
					order="2" type="@OP_F_TYPE@" name="op" /></analysis-function>
		</analysis></analyses>
	<operations></operations></analysis-specification>
