<?xml version="1.0" encoding="UTF-8"?>

<!--
  Part of the MUST Project, under BSD-3-Clause License
 See https://hpc.rwth-aachen.de/must/LICENSE for license information.
  SPDX-License-Identifier: BSD-3-Clause
-->

<!DOCTYPE analysis-specification SYSTEM "@MUST_SPECIFICATION_DTD_PATH@/analysis-specification.dtd">
<analysis-specification path-to-libs="@CMAKE_INSTALL_PREFIX@/modules" include-path="@CMAKE_CURRENT_SOURCE_DIR@/modules" group-name="Basic">
	<analyses>
		<analysis name="TestLocation">
			<registered-name>TestLocation</registered-name>
			<module-name>libtestLocation</module-name>
			<header-name>I_TestLocation.h</header-name>
			<interface-type>I_TestLocation</interface-type>
			<is-global>0</is-global>
			<is-process-global>0</is-process-global>
			<dependencies>
				<analysis-depend group="MUST_Base">ParallelIdAnalysis</analysis-depend>
				<analysis-depend group="MUST_Base">LocationAnalysis</analysis-depend></dependencies>
			<analysis-function name="print">
				<analysis-argument order="0" type="uint64_t" name="pId" /><analysis-argument
					order="1" type="uint64_t" name="lId" /></analysis-function>
		</analysis>
		<analysis name="TestLog">
			<registered-name>TestLog</registered-name>
			<module-name>libtestLog</module-name>
			<header-name>I_TestLog.h</header-name>
			<interface-type>I_TestLog</interface-type>
			<is-global>0</is-global>
			<is-process-global>0</is-process-global>
			<dependencies>
				<analysis-depend group="MUST_Base">CreateMessage</analysis-depend></dependencies>
			<analysis-function name="test"><analysis-argument order="0" type="uint64_t" name="pId" /><analysis-argument order="1" type="uint64_t" name="lId" /></analysis-function>
		</analysis></analyses>
	<operations></operations></analysis-specification>
