<?xml version="1.0" encoding="UTF-8"?>

<!--
  Part of the MUST Project, under BSD-3-Clause License
 See https://hpc.rwth-aachen.de/must/LICENSE for license information.
  SPDX-License-Identifier: BSD-3-Clause
-->

<!DOCTYPE analysis-specification SYSTEM "@MUST_SPECIFICATION_DTD_PATH@/analysis-specification.dtd">
<analysis-specification path-to-libs="@CMAKE_INSTALL_PREFIX@/modules" include-path="@CMAKE_CURRENT_SOURCE_DIR@/modules" group-name="TestDatatypeTrack">
	<analyses>
		<analysis name="PrintDatatype">
			<registered-name>PrintDatatype</registered-name>
			<module-name>libprintDatatype</module-name>
			<header-name>I_PrintDatatype.h</header-name>
			<interface-type>I_PrintDatatype</interface-type>
			<is-global>0</is-global>
			<is-process-global>0</is-process-global>
			<dependencies>
				<analysis-depend group="MUST_Resource">DatatypeTrack</analysis-depend>
				<analysis-depend group="MUST_Base">CreateMessage</analysis-depend></dependencies>
			<analysis-function name="print">
				<analysis-argument order="0" type="uint64_t" name="pId" /><analysis-argument
					order="1" type="uint64_t" name="lId" /><analysis-argument
					order="2" type="@DATATYPE_F_TYPE@" name="type">
</analysis-argument></analysis-function>
		</analysis></analyses>
	<operations></operations></analysis-specification>
